{
  "id": "nhung-nguyen",
  "name": "Nguyễn Thị Hằng Nhung",
  "role": "QC Engineer & Content Author",
  "bio": "QC Engineer đang học ISTQB Foundation Level. Tác giả nội dung bài học và Real Bug of the Week cho QC Pet.",
  "github_handle": "nhungnth14",
  "expertise": ["Bug Detection", "Test Case Design", "ISTQB Foundation"]
}
